{
  "version": "0.1",
  "name": "TabletopChatExperience",
  "type": "window",
  "width": 1280.0,
  "height": 820.0,
  "theme": "dark",
  "resources": {
    "Brush.Brand.Purple": "#8462E8",
    "Brush.Neutral.Darkbg": "#18161E",
    "Brush.Neutral.Surface": "#23202C",
    "Brush.Neutral.Cardbg": "#2E2A3A",
    "Brush.Text.Primary": "#FAF7FD",
    "Brush.Text.Secondary": "#A49BB3"
  },
  "root": {
    "id": "win-root",
    "type": "window",
    "name": "MainWindow",
    "source": {
      "format": "vellum",
      "nodeId": "win-root",
      "nodeName": "MainWindow",
      "sourceType": "frame"
    },
    "layout": {
      "type": "grid",
      "direction": "vertical",
      "gap": 12.0,
      "padding": 16.0,
      "widthMode": "fill",
      "heightMode": "fill",
      "constraintH": "left",
      "constraintV": "top",
      "designWidth": 1280.0,
      "designHeight": 820.0,
      "x": 0.0,
      "y": 0.0,
      "rows": [
        50.0,
        "*",
        54.0
      ]
    },
    "style": {
      "background": "#18161E",
      "cornerRadius": 12.0
    },
    "children": [
      {
        "id": "app-header",
        "type": "card",
        "name": "AppHeader",
        "source": {
          "format": "vellum",
          "nodeId": "app-header",
          "nodeName": "AppHeader",
          "sourceType": "frame"
        },
        "layout": {
          "type": "stack",
          "direction": "horizontal",
          "gap": 16.0,
          "padding": 12.0,
          "widthMode": "fill",
          "heightMode": "fixed",
          "constraintH": "stretch",
          "constraintV": "top",
          "designWidth": 1248.0,
          "designHeight": 50.0,
          "x": 16.0,
          "y": 16.0,
          "height": 50.0,
          "gridRow": 0
        },
        "style": {
          "background": "#23202C",
          "cornerRadius": 8.0
        },
        "children": [
          {
            "id": "app-title",
            "type": "text",
            "name": "TitleText",
            "source": {
              "format": "vellum",
              "nodeId": "app-title",
              "nodeName": "TitleText",
              "sourceType": "text"
            },
            "layout": {
              "widthMode": "fixed",
              "heightMode": "fixed",
              "constraintH": "left",
              "constraintV": "top",
              "designWidth": 320.0,
              "designHeight": 22.0,
              "x": 12.0,
              "y": 14.0,
              "width": 320.0,
              "height": 22.0
            },
            "style": {
              "foreground": "#FAF7FD",
              "fontSize": 15.0,
              "fontWeight": 600,
              "fontFamily": "Segoe UI",
              "textAlign": "left"
            },
            "props": {
              "text": "⚔ Tabletop Campaign Workspace"
            }
          },
          {
            "id": "app-subtitle",
            "type": "text",
            "name": "SubtitleText",
            "source": {
              "format": "vellum",
              "nodeId": "app-subtitle",
              "nodeName": "SubtitleText",
              "sourceType": "text"
            },
            "layout": {
              "widthMode": "fixed",
              "heightMode": "fixed",
              "constraintH": "left",
              "constraintV": "top",
              "designWidth": 400.0,
              "designHeight": 20.0,
              "x": 348.0,
              "y": 15.0,
              "width": 400.0,
              "height": 20.0
            },
            "style": {
              "foreground": "#A49BB3",
              "fontSize": 12.0,
              "fontWeight": 400,
              "fontFamily": "Segoe UI",
              "textAlign": "left"
            },
            "props": {
              "text": "Session #14: The Whispering Caverns · In Progress"
            }
          }
        ]
      },
      {
        "id": "main-workspace",
        "type": "panel",
        "name": "MainWorkspace",
        "source": {
          "format": "vellum",
          "nodeId": "main-workspace",
          "nodeName": "MainWorkspace",
          "sourceType": "frame"
        },
        "layout": {
          "type": "grid",
          "direction": "horizontal",
          "gap": 12.0,
          "widthMode": "fill",
          "heightMode": "fill",
          "constraintH": "stretch",
          "constraintV": "stretch",
          "designWidth": 1248.0,
          "designHeight": 660.0,
          "x": 16.0,
          "y": 78.0,
          "columns": [
            260.0,
            "*",
            260.0
          ],
          "gridRow": 1
        },
        "children": [
          {
            "id": "char-sidebar",
            "type": "card",
            "name": "CharacterSidebar",
            "source": {
              "format": "vellum",
              "nodeId": "char-sidebar",
              "nodeName": "CharacterSidebar",
              "sourceType": "frame"
            },
            "layout": {
              "type": "stack",
              "direction": "vertical",
              "gap": 10.0,
              "padding": 16.0,
              "widthMode": "fixed",
              "heightMode": "fill",
              "constraintH": "left",
              "constraintV": "stretch",
              "designWidth": 260.0,
              "designHeight": 660.0,
              "x": 0.0,
              "y": 0.0,
              "width": 260.0,
              "gridColumn": 0
            },
            "style": {
              "background": "#23202C",
              "cornerRadius": 10.0
            },
            "children": [
              {
                "id": "char-heading",
                "type": "text",
                "name": "CharactersHeading",
                "source": {
                  "format": "vellum",
                  "nodeId": "char-heading",
                  "nodeName": "CharactersHeading",
                  "sourceType": "text"
                },
                "layout": {
                  "widthMode": "fixed",
                  "heightMode": "fixed",
                  "constraintH": "left",
                  "constraintV": "top",
                  "designWidth": 228.0,
                  "designHeight": 20.0,
                  "x": 16.0,
                  "y": 16.0,
                  "width": 228.0,
                  "height": 20.0
                },
                "style": {
                  "foreground": "#A49BB3",
                  "fontSize": 11.0,
                  "fontWeight": 600,
                  "fontFamily": "Segoe UI",
                  "textAlign": "left"
                },
                "props": {
                  "text": "CHARACTERS (3)"
                }
              },
              {
                "id": "card-player-a",
                "type": "card",
                "name": "PlayerACard",
                "source": {
                  "format": "vellum",
                  "nodeId": "card-player-a",
                  "nodeName": "PlayerACard",
                  "sourceType": "frame"
                },
                "layout": {
                  "type": "stack",
                  "direction": "vertical",
                  "gap": 4.0,
                  "padding": 10.0,
                  "widthMode": "fixed",
                  "heightMode": "fixed",
                  "constraintH": "left",
                  "constraintV": "top",
                  "designWidth": 228.0,
                  "designHeight": 64.0,
                  "x": 16.0,
                  "y": 46.0,
                  "width": 228.0,
                  "height": 64.0
                },
                "style": {
                  "background": "#2E2A3A",
                  "cornerRadius": 8.0
                },
                "children": [
                  {
                    "id": "text-player-a-name",
                    "type": "text",
                    "name": "PlayerAName",
                    "source": {
                      "format": "vellum",
                      "nodeId": "text-player-a-name",
                      "nodeName": "PlayerAName",
                      "sourceType": "text"
                    },
                    "layout": {
                      "widthMode": "fixed",
                      "heightMode": "fixed",
                      "constraintH": "left",
                      "constraintV": "top",
                      "designWidth": 208.0,
                      "designHeight": 20.0,
                      "x": 10.0,
                      "y": 10.0,
                      "width": 208.0,
                      "height": 20.0
                    },
                    "style": {
                      "foreground": "#FAF7FD",
                      "fontSize": 13.0,
                      "fontWeight": 600,
                      "fontFamily": "Segoe UI",
                      "textAlign": "left"
                    },
                    "props": {
                      "text": "Player A - Valerius (Paladin)"
                    }
                  },
                  {
                    "id": "text-player-a-stat",
                    "type": "text",
                    "name": "PlayerAStats",
                    "source": {
                      "format": "vellum",
                      "nodeId": "text-player-a-stat",
                      "nodeName": "PlayerAStats",
                      "sourceType": "text"
                    },
                    "layout": {
                      "widthMode": "fixed",
                      "heightMode": "fixed",
                      "constraintH": "left",
                      "constraintV": "top",
                      "designWidth": 208.0,
                      "designHeight": 18.0,
                      "x": 10.0,
                      "y": 34.0,
                      "width": 208.0,
                      "height": 18.0
                    },
                    "style": {
                      "foreground": "#A49BB3",
                      "fontSize": 11.0,